{"assigned_at":"2026-09-04T10:41:56.993Z","attempt_id":"attempt-control-1","benchmark_id":"p2.17-release-replay","blind_id":"blind-000004","call_plan_binding":{"path":"replay/call-plans/adjudicate.json","sha256":"3f24977e46d8572fef970d684c797fd1741bf494afd28b1782dcc74ab6bf2792"},"delta_seal_references":[],"grader_id":"adjudicator-03","grader_revision":"v1","plan_revision":"v1","request_path":"grader-runs/blind-000004/adjudicator-03-v1/request.json","runtime_capability_binding":{"path":"preflight/runtime-capability.json","sha256":"e1700f0078fe7883285b770ef1ea8e20658888dd13af873d33044322132c0d80"},"schema_version":1,"stage":"adjudicate","task_id":"task-1","traffic_class":"adjudication"}
